timestamp,model,model_parameters,tester,question,response,response_length_chars,estimated_tokens,inference_time_s,time_to_first_token_s,tokens_per_second,cpu_baseline_percent,cpu_average_percent,cpu_per_core,cpu_freq_mhz,memory_baseline_mb,memory_peak_mb,memory_increase_mb,memory_percent,temperature_c,throttled,avg_voltage_v,estimated_current_a,avg_power_watts,total_energy_joules,tokens_per_joule,io_read_count,io_write_count,io_read_bytes,io_write_bytes,io_read_time_ms,io_write_time_ms,io_total_ops,io_total_bytes,io_iops,io_throughput_mb_s,io_avg_read_latency_ms,io_avg_write_latency_ms
2025-12-05T12:57:36.096833,deepseek-r1:7b,7B,dorian,Describe gravity in simple terms for someone that doesn’t know anything about it,"Gravity is a natural force that pulls everything towards each other. It's what keeps us on the ground, makes things fall when you let go, and holds all objects in place. Imagine if there was no gravity; then we'd float away into space, and our shoes would just float off as we tied them! Gravity keeps Earth and everything around it from floating apart and ensures that lid stays on its jar. Without gravity, life as we know it wouldn't exist because it's the force that gives us weight and keeps us grounded.",509,548,826.844,73.501,0.66,1.0,99.37,"[9.1, 0.0, 0.0, 0.0]",1800.0,538.62,5300.89,4762.27,67.6,83.7,throttled=0xe0008,0.901,2.985,2.691,2224.654,0.2463,29820,1249,477962240,5165056,37089,111,31069,483127296,37.58,0.557,1.24,0.09
2025-12-05T13:11:24.553881,deepseek-r1:7b,7B,dorian,Describe gravity for someone that knows about it and wants to know more about it,"Gravity is the force that keeps us grounded on Earth and shapes our understanding of the universe beyond our immediate surroundings. Here's an engaging explanation:

Gravity is a fundamental force of nature that attracts two objects with mass toward each other. It's what makes apples fall from trees, why we remain firmly on the ground, and even keeps planets orbiting around stars in our solar system. While it seems weak compared to forces like electromagnetism, gravity is crucial because its effects are evident over vast distances.

This force is described by Einstein's theory of general relativity, which views gravity not as a traditional force but as the curvature of spacetime caused by mass and energy. Despite its subtle presence in our daily lives, gravity plays a dominant role on a cosmic scale, influencing everything from the orbit of Earth around the Sun to the structure of galaxies.

In summary, gravity is the universal force that ensures we stay connected to the Earth and explore the endless possibilities of space, all while being the most dominant yet relatively weak force in the universe.",1116,620,922.474,14.358,0.67,0.0,99.62,"[0.0, 0.0, 0.0, 0.0]",1800.0,5291.03,5306.09,15.06,67.6,83.2,throttled=0xe0008,0.881,2.991,2.636,2431.356,0.255,186,60,806912,380928,219,156,246,1187840,0.27,0.001,1.18,2.6
2025-12-05T13:26:48.639790,deepseek-r1:7b,7B,dorian,Find a good analogy to describe gravity to someone.,"Imagine placing a large, heavy ball (like Earth) at the center of a trampoline. This heavy ball creates a deep curve in the fabric of the trampoline. If you roll a small marble on it, the marble will naturally move toward the heavier ball along the curve because gravity pulls objects toward the mass. Just like how an apple falls to the ground or how satellites orbit Earth!",375,371,553.551,12.315,0.67,1.0,99.6,"[0.0, 0.0, 0.0, 0.0]",1800.0,5289.16,5309.92,20.77,67.7,83.7,throttled=0xe0008,0.881,2.99,2.634,1458.209,0.2544,0,26,0,139264,0,41,26,139264,0.05,0.0,0,1.58
2025-12-05T13:36:03.802418,deepseek-r1:7b,7B,dorian,give a small quiz (3 questions) about gravity,"1. What is gravity?  
Gravity is the force that pulls objects toward each other, especially Earth pulling things downward.

2. Approximately what percentage of Earth’s gravity is due to its mass?  
About 98%.

3. What keeps the Moon orbiting Earth?  
The Moon orbits because Earth’s gravity pulls it, creating a regular pattern in space.",337,311,463.782,12.288,0.67,1.0,99.63,"[0.0, 0.0, 0.0, 0.0]",1800.0,5292.22,5311.17,18.95,67.7,83.2,throttled=0xe0008,0.882,2.991,2.639,1224.129,0.2541,0,23,0,126976,0,36,23,126976,0.05,0.0,0,1.57
2025-12-05T13:43:49.196021,deepseek-r1:7b,7B,dorian,Do you think I need a big jacket if the weather is 10 degrees Celsius ?,"It depends on how warm you are already dressed! If it's 10°C (50°F) outside, you might not need a big jacket unless your current clothes aren't providing enough warmth. If you're wearing layers like a sweater or cardigan, you might still be fine without an extra jacket. However, if the wind is strong or you're feeling particularly chilly, even a small jacket could help keep you warm. Layering around the neck and arms can also provide additional protection from the cold. Let me know how you feel about adding layers!",520,322,487.017,19.305,0.66,0.0,99.64,"[0.0, 0.0, 0.0, 0.0]",1800.0,5296.27,5311.61,15.34,67.7,82.7,throttled=0xe0008,0.882,2.991,2.638,1284.725,0.2506,0,27,0,147456,0,41,27,147456,0.06,0.0,0,1.52
2025-12-05T13:51:57.824025,deepseek-r1:7b,7B,dorian,Give a common myth about gravity and explain why it is false,"The myth is that objects accelerate differently based on their mass during free fall due to gravity. People often believe that heavier objects fall faster than lighter ones, but this isn't correct. In reality, all objects—regardless of mass—are accelerated at the same rate by gravity in a vacuum or when air resistance is negligible. The reason some think it's about mass versus weight is that they confuse inertial mass (how much an object resists acceleration) with gravitational mass (the force exerted on it). In reality, both heavy and light objects fall at the same speed because gravity acts equally on all of them once air resistance is accounted for. So, the myth is false because it ignores the role of air resistance in determining the actual rate of fall.",768,512,759.067,13.902,0.67,0.0,99.64,"[0.0, 0.0, 0.0, 0.0]",1800.0,5294.05,5313.17,19.12,67.7,83.2,throttled=0xe0008,0.879,2.991,2.63,1996.474,0.2565,0,35,0,188416,0,51,35,188416,0.05,0.0,0,1.46
2025-12-05T14:04:38.502333,deepseek-r1:7b,7B,dorian,Explain why a plane can fly even with gravity in simple bullet points,"Planes fly because they generate lift to overcome gravity. Here's how:

1. **Wings Create Lift:** The shape of an airplane wing (airfoil) causes air to move faster over it than under it. This faster airflow creates less pressure above the wing compared to below, resulting in an upward force called lift.

2. **Bernoulli's Principle:** This principle explains that as the speed of a fluid (like air) increases, its pressure decreases. So, higher-speed airflow over the wing reduces pressure there, increasing lift.

3. **Thrust and Forward Motion:** Engines provide thrust, pushing the plane forward through the air. This motion ensures the wings cover a large area quickly, maximizing the pressure difference and lift generated.

4. **Lift Equals Weight:** When lift is greater than or equal to the plane's weight (including passengers and cargo), the plane ascends; otherwise, it descends.

In summary, planes fly by generating enough lift through wing airflow and thrust, countering gravity and allowing them to rise into the sky.",1033,844,1246.162,15.661,0.68,1.0,99.68,"[0.0, 0.0, 0.0, 0.0]",1800.0,5296.44,5314.76,18.32,67.7,82.3,throttled=0xe0008,0.878,2.992,2.629,3275.8,0.2576,0,58,0,319488,0,93,58,319488,0.05,0.0,0,1.6
2025-12-05T14:25:26.275883,deepseek-r1:7b,7B,dorian,what are the steps to write a master thesis ?,"Writing a master's thesis is a structured journey that involves several key steps. Here's a concise guide to help you navigate through it:

1. **Topic Selection**: Choose a specific and manageable topic. Look for gaps in existing literature or narrow down an existing study by adding variables.

2. **Research Question**: Formulate a clear, focused question that guides your research. Ensure it is well-defined and precise.

3. **Literature Review**: Conduct a comprehensive review using credible sources from academic databases. Focus on both foundational works and recent studies to identify trends and gaps.

4. **Methodology Development**: Outline your research methods clearly before data collection. Consider courses or workshops if you need help with research design, ensuring ethical considerations are addressed, especially for human participants.

5. **Data Collection**: Depending on whether it's quantitative or qualitative, collect appropriate data while adhering to ethical guidelines like informed consent.

6. **Data Analysis**: Use suitable tools and techniques (statistical software for quantitative, coding for qualitative) to analyze your data effectively.

7. **Thesis Drafting**:
   - **Introduction**: Provide background, state the research problem, and pose your question.
   - **Literature Review**: Contextualize where your study fits within existing knowledge.
   - **Methodology**: Explain how you conducted your research concisely.
   - **Results**: Present findings clearly, possibly with visual aids like charts or graphs.
   - **Discussion**: Interpret results, compare them with others, and discuss implications.

8. **Final Touches**: Ensure a thorough proofread for errors and check formatting against guidelines. Prepare for a potential thesis defense.

9. **Time Management**: Plan each phase to avoid last-minute stress, using tools like Gantt charts to track progress.

By following these steps thoughtfully and avoiding common pitfalls like lack of planning or broad topics, you can effectively navigate the process of writing your master's thesis.",2088,1041,1551.275,12.378,0.67,1.5,99.69,"[0.0, 0.0, 0.0, 0.0]",1800.0,5299.14,5315.91,16.77,67.8,83.2,throttled=0xe0008,0.879,2.993,2.631,4082.103,0.255,2,87,8192,536576,2,292,89,544768,0.06,0.0,1.0,3.36
2025-12-05T14:51:19.162047,deepseek-r1:7b,7B,dorian,What are the pros and cons of nuclear energy ?,"Nuclear energy offers several advantages while also presenting some challenges:

**Pros of Nuclear Energy:**
1. **Clean Energy Source:** Produces electricity without emitting greenhouse gases like CO2 during fuel combustion, reducing air pollution from emissions.
2. **Stable Energy Supply:** Reliably provides consistent energy production, less dependent on natural resource availability compared to fossil fuels.
3. **Sustainable Fuel Source:** Uranium fuel rods do not deplete over time, offering a sustainable alternative in the long term.
4. **Reduced Particulate Emissions:** Produces fewer harmful particulates compared to burning coal, contributing to better environmental health.
5. **Efficient Resource Use:** Produces electricity with high energy density relative to other fuels.

**Cons of Nuclear Energy:**
1. **Nuclear Waste:** Radioactive waste from decommissioned plants could take centuries to safely decompose, posing a long-term risk.
2. **Safety Concerns:** Catastrophic accidents, as seen in Chernobyl, can release large amounts of radiation with severe consequences.
3. **High Costs:** Inexpensive to build initially but involves significant ongoing costs for maintenance and decommissioning.
4. **Environmental Impact from Construction:** Can disturb natural habitats and require substantial land use, affecting biodiversity.
5. **Risks in Waste Disposal:** Potential for water contamination or soil damage if waste is not managed properly.
6. **Dependency on Technology:** Reliance on specialized knowledge and materials increases costs; also, political or economic shifts could disrupt global supply.

Overall, nuclear energy balances trade-offs between safety concerns and long-term environmental impact against benefits such as efficiency and sustainability.",1785,1081,1601.345,12.437,0.68,0.5,99.69,"[0.0, 0.0, 0.0, 0.0]",1800.0,5298.69,5315.83,17.14,67.7,82.7,throttled=0xe0008,0.88,2.993,2.633,4216.555,0.2564,1,74,131072,405504,3,115,75,536576,0.05,0.0,3.0,1.55
2025-12-05T15:18:02.118741,deepseek-r1:7b,7B,dorian,I am strugulling with C++ where should i start ?,"To effectively learn C++, follow this structured plan:

1. **Start with Fundamentals**: Begin with variables (integers, strings), data types, control flow (if-else, loops), and basic input/output operations. These basics form the foundation for any programming.

2. **Master Functions**: Learn how to write functions, including simple ones first, then move to more complex tasks like recursion. Modularizing code will help in creating organized and reusable solutions.

3. **Object-Oriented Programming (OOP)**: Dive into OOP concepts such as classes and objects. Understanding inheritance and polymorphism will enhance your ability to create dynamic and flexible programs.

4. **Data Structures**: Study arrays, linked lists, stacks, queues, trees, and graphs. Implementing these will improve your efficiency in handling data storage and retrieval.

5. **File Handling and Standard Libraries**: Familiarize yourself with file I/O operations and standard libraries like <algorithm> for efficient coding practices.

6. **Engage in Projects**: Build small projects such as calculators or text editors to apply your knowledge practically. Start simple, then move on to more complex applications.

7. **Resources and Practice**: Use recommended books like ""C++ Primer"" and online courses from platforms like Coursera or Udemy. Regular practice through exercises and projects is crucial for retention.

By following this structured approach, you'll build a solid foundation in C++, making advanced topics more manageable as you progress.",1532,1083,1600.861,14.884,0.68,0.5,99.7,"[9.1, 9.1, 0.0, 0.0]",1800.0,5295.43,5316.72,21.29,67.8,82.3,throttled=0xe0008,0.88,2.993,2.635,4218.189,0.2567,0,87,0,516096,0,173,87,516096,0.05,0.0,0,1.99
