timestamp,model,model_parameters,tester,question,response,response_length_chars,estimated_tokens,inference_time_s,time_to_first_token_s,tokens_per_second,cpu_baseline_percent,cpu_average_percent,cpu_per_core,cpu_freq_mhz,memory_baseline_mb,memory_peak_mb,memory_increase_mb,memory_percent,temperature_c,throttled,avg_voltage_v,estimated_current_a,avg_power_watts,total_energy_joules,tokens_per_joule
2025-11-17T12:40:17.050534,tinyllama:latest,"1,1B",dorian,Describe gravity in simple terms for someone that doesn’t know anything about it,"Gravity is the force that holds objects together, and can be defined in very simple terms as a pull or attraction between two objects. It is often used to explain how things fall or float in the air. The strength of gravity depends on several factors like mass, distance, and acceleration, but at a basic level, gravity is a universal law that holds all matter together regardless of its size or shape.

In everyday life, gravity can be felt when objects are thrown towards each other at high speeds, such as when a tennis ball is hit into a bowling alley or a person tries to catch a falling baseball. Gravity also applies to objects that are stationary or immobile, like buildings, cars, and planes. Objects with heavy weights, such as chairs, can create a strong pull between them.

In science fiction stories and movies, gravity is often represented as a force that pushes back against the laws of physics, allowing objects to float through space or defy the laws of gravity in other ways. In real life, however, gravity is just one of many forces that influence the behavior of matter and energy at different scales.",1121,242,47.747,5.462,5.07,0.0,99.07,"[0.0, 0.0, 0.0, 0.0]",1800.0,434.5,1142.82,708.32,14.3,62.8,throttled=0x80000,0.926,2.978,2.757,131.654,1.8382
2025-11-17T12:41:06.406960,tinyllama:latest,"1,1B",dorian,Describe gravity for someone that knows about it and wants to know more about it,"Gravity is the force of attraction between any two objects in the universe, which causes them to move toward each other. In simple terms, gravity is the attraction between two objects with mass or density due to their gravitational field. When two objects come closer to one another, their masses or densities increase and their gravitational pull on each other increases as well. This results in an ever-increasing force that pulls them together until they eventually touch.

There are many examples of gravity at work in the universe, including:

1. The Earth's gravity is responsible for keeping our planet upright and in orbit around the sun.

2. The force of gravity between the moon and the Earth is due to their mutual attraction as they orbit around the same center of mass.

3. The gravitational pull between two stars as they orbit each other is due to their mutual attraction due to their combined mass.

4. The moon's gravity on Earth is responsible for maintaining its orbit and keeping it in the same place.

In short, gravity is a powerful force that controls the behavior of objects in our universe and is responsible for everything from the motion of planets to the movement of stars.",1201,262,51.914,1.859,5.05,0.0,97.4,"[0.0, 0.0, 0.0, 0.0]",1800.0,1118.59,1129.58,11.0,14.4,67.6,throttled=0x80000,0.926,2.938,2.72,141.218,1.8553
2025-11-17T12:41:59.929841,tinyllama:latest,"1,1B",dorian,Find a good analogy to describe gravity to someone.,"Certainly! Here's an analogy for you:

Gravity is like the pull of an old-fashioned clock that you can feel ticking away in your ear when you stand still, waiting patiently for something to happen. It may seem unobtrusive and insignificant, but it plays a vital role in keeping objects on Earth, including humans, aloft.

For example, let's say you're walking down the street, and you accidentally step into a manhole cover that's about to drop onto the pavement below. As you step back, you feel a gentle push from the gravity pull. This force is what keeps your feet on the ground and enables you to safely make your way across the street.

When gravity is strong enough to lift objects off the ground, it's called ""gravity,"" as in ""there's no gravity"" or ""gravitational pull."" Gravity can also be described in more formal terms, such as a ""force of attraction,"" a ""tendency to attract,"" or an ""effect on a system.""

So there you have it - a useful analogy for explaining gravity!",982,252,53.332,1.708,4.73,0.0,95.75,"[0.0, 0.0, 0.0, 0.0]",1800.0,1132.33,1134.95,2.62,14.3,71.5,throttled=0x80000,0.926,2.898,2.684,143.121,1.7607
2025-11-17T12:42:54.869654,tinyllama:latest,"1,1B",dorian,give a small quiz (3 questions) about gravity,"1. What is the weight of an object in freefall?
    Answer: The object's mass is in free fall, and its weight is calculated by multiplying its mass by the gravitational acceleration (G), which is defined as the force that pulls objects downward at a rate of 9.81 meters per second squared. This formula simplifies to:
    
    Weight = Mass x Gravity Acceleration

2. What happens to an object in space?
    Answer: The laws of gravity do not apply in space because there is no mass or object on which to pull downward. Objects in space are accelerating at the speed of light, so they cannot fall due to the gravitational force (which is also known as a tidal force). 

3. What causes objects to fall from high altitude?
    Answer: Gravity. The acceleration of gravity, which is defined as the rate at which an object falls, increases with altitude. Higher altitudes (more elevation) result in a greater distance traveled by the object before it reaches its final destination. 

Quiz questions about gravity",1008,245,46.727,1.783,5.24,0.0,98.35,"[0.0, 0.0, 0.0, 0.0]",1800.0,1122.03,1122.31,0.28,14.3,74.0,throttled=0x80000,0.926,2.96,2.741,128.091,1.9127
2025-11-17T12:43:43.205020,tinyllama:latest,"1,1B",dorian,Do you think I need a big jacket if the weather is 10 degrees Celsius ?,"As per your question, it's generally not necessary to wear a big jacket in a temperature range of 10-15 degrees Celsius. However, if you live in areas with extreme temperatures like cold winter or hot summer, you may need to dress appropriately depending on the weather conditions. In such cases, a lightweight and breathable jacket can be an effective option that will help protect you from the weather while keeping you comfortable.",434,95,20.072,2.448,4.73,0.0,97.61,"[0.0, 0.0, 0.0, 0.0]",1800.0,1121.81,1127.91,6.09,14.4,74.0,throttled=0x80000,0.926,2.943,2.725,54.692,1.737
2025-11-17T12:44:04.884842,tinyllama:latest,"1,1B",dorian,Give a common myth about gravity and explain why it is false,"One of the most common myths about gravity that people believe is that it's a force that pulls objects toward a point in space, as depicted in the image below. However, this is not the case:

![image](https://i.imgur.com/lLKmXv2.png)

The picture above shows two objects, one on a fixed plane (the floor), and another object on the ground (with a point of support). As you can see, gravity does not pull either object toward the other in this situation. Instead, gravity acts in a direction perpendicular to the floor, which is parallel to both objects at the same time.

To understand why gravity behaves differently in different situations, we need to consider the following:

1. Gravity depends on mass and distance: A massive object (like the planet Venus) with a large surface area will have more mass than smaller objects with a small surface area. As a result, the force of gravity is also greater for Venus compared to Earth or Mars (which have similar masses).

2. Gravity depends on inertia: Inertial forces are those that act in the direction opposite to the motion of an object. The more massive an object is, the slower it moves due to its higher inertia. As a result, objects with high inertias (like Venus) have a lower gravitational pull than smaller objects like Earth or Mars.

3. Gravity depends on the object's shape and mass: Objects can have different shapes that affect their overall gravitational pull. For example, an object with a flat surface area (like a sphere) may have greater gravity than a curved surface area (like a cylinder).

In summary, gravity is a force that acts in the direction opposite to the acceleration of an object due to its mass, and it behaves differently based on object mass, shape, and inertia.",1748,411,90.412,1.854,4.55,0.0,95.73,"[0.0, 0.0, 0.0, 0.0]",1800.0,1125.24,1126.21,0.96,14.3,77.9,throttled=0x80000,0.926,2.897,2.683,242.576,1.6943
2025-11-17T12:45:36.905362,tinyllama:latest,"1,1B",dorian,Explain why a plane can fly even with gravity in simple bullet points,"1. Gravity: Planes have weighted engines, fuel tanks and brakes to counteract the effects of weightlessness on an aircraft.

2. Aircraft structure: The wings of planes are rigid and heavy structures that allow for lift and stability in flight.

3. G-force sensors: Pilots use G-force sensors to measure the amount of force applied to the plane, which helps them gauge how much weight they need to counteract.

4. Airframe design: The shape and size of an aircraft's airframe play a role in its ability to fly. Aircraft with longer wings or more streamlined designs can better control their descent and achieve better G-loading.

5. Gravity compensation systems: Planes also have Gravity Compensation (GC) systems that adjust the plane's weight as it descends, allowing pilots to maintain a stable altitude without relying on manual pilot input.

6. Navigation and flight data systems: Pilots use various types of navigation and flight data systems to navigate, track the plane and maintain altitude while in flight. 

7. Human factors: Humans are responsible for maintaining the aircraft's weight and balance during takeoff, landing and any other phases of flight.",1164,273,55.033,1.937,4.96,0.0,98.02,"[0.0, 0.0, 0.0, 0.0]",1800.0,1122.07,1122.8,0.73,14.3,79.3,throttled=0x80000,0.926,2.952,2.734,150.455,1.8145
2025-11-17T12:46:33.546386,tinyllama:latest,"1,1B",dorian,what are the steps to write a master thesis ?,"Sure, here are the basic steps to write a Master TheSiS:

1. Define your character(s) and their backstory: Think of each character as having their own motivations and aspirations, their unique personalities, strengths, weaknesses, and goals. Write down their background, experiences, and relationships with others.

2. Create a world: Imagine an alternate reality that exists in your story. Develop the setting, the people, the technology, the society, and any other details that will help bring the world to life for your readers.

3. Outline your plot: Use an outline or story map to create a basic structure of your story. Break it into smaller sections, each with a clear beginning, middle, and end.

4. Develop characters: Each character should have their own distinct personality, backstory, motivations, relationships, and personal conflicts that will drive the plot forward.

5. Write the dialogue: Incorporate realistic conversation between your characters to create believable interactions, even if they don't speak a common language or possess certain skills.

6. Write the action: Plan out the actions of each character and their roles in achieving the goal(s) of the story.

7. Edit and revise: Finally, go back over your draft and make sure everything is balanced, logical, and flows smoothly. Make revisions where necessary to improve the plot, characters, and overall storytelling.

Remember, writing a Master TheSiS requires creativity, patience, and attention to detail. By following these steps, you can create a compelling and engaging narrative that will captivate your readers and transport them to an alternate reality!",1642,372,75.979,1.795,4.9,0.0,98.1,"[0.0, 0.0, 0.0, 0.0]",1800.0,1118.9,1127.18,8.27,14.4,80.8,throttled=0x80000,0.922,2.954,2.723,206.867,1.7983
2025-11-17T12:47:51.133132,tinyllama:latest,"1,1B",dorian,What are the pros and cons of nuclear energy ?,"Nuclear Energy has both pros and cons. Below are some key aspects of nuclear power:

Pros:
1. No greenhouse gas emissions: Nuclear power plants produce no greenhouse gases or other pollutants, unlike fossil fuel-based plants which emit carbon dioxide and other pollutants into the atmosphere.
2. Hydrogen fuel cell: Nuclear reactors can also produce hydrogen fuel cells (used in hydrogen cars) to power the vehicles on the road.
3. High-temperature steam power: This produces more energy per unit of mass than coal-fired power plants or any other source of nuclear-generated electricity.
4. Reduced greenhouse gas emissions: Nuclear reactors are designed to produce little to no greenhouse gases and can even emit carbon dioxide as a byproduct.
5. Safety: Nuclear plants are highly monitored and regulated, and have strict safety protocols in place. However, they do pose some risks of accidents, including nuclear meltdowns.

Cons:
1. Cost: Nuclear power plants can be expensive to build and maintain, especially those that operate for years or decades without refueling.
2. Environmental impact: Nuclear waste storage and disposal can lead to environmental issues down the road, and some opponents argue that nuclear power is not a sustainable option in the long term.
3. Displacement of coal-fired plants: Coal-fired power plants have a significant carbon footprint, which may eventually be displaced by nuclear-generated electricity.
4. Public perception: Nuclear energy has faced some public opposition and skepticism due to past incidents, such as the Chernobyl disaster in 1986, that have caused concern among some communities.

Therefore, while nuclear energy can have significant benefits in terms of renewable energy and reducing greenhouse gas emissions, there are also significant drawbacks that need to be considered.",1830,443,88.407,1.659,5.01,0.5,99.37,"[0.0, 0.0, 0.0, 0.0]",1800.0,1124.68,1129.13,4.45,14.3,81.3,throttled=0x80000,0.916,2.985,2.733,241.599,1.8336
2025-11-17T12:49:21.148868,tinyllama:latest,"1,1B",dorian,I am strugulling with C++ where should i start ?,"Here are some suggestions for where to start learning C++:

1. Reading books - there are many great books available that teach C++ as a beginner-friendly language. Some good options include ""C++ Primer"" by Robert W. McInerney and ""C++ Programming Language"" by David Flanagan, both from O’Reilly Media.

2. Watching YouTube tutorials - there are many popular YouTube channels that teach C++ programming concepts like functions, loops, arrays, and more. Look for channels such as ""CppCon UK"", ""CppCon US"", or ""C++: The Complete Reference"" by Microsoft.

3. Reading online coding resources - some online coding resources offer free tutorials and guides on C++. Some popular ones include Codecademy, Programming Language Tutorials, and Udacity's C++ course.

4. Googling - there are many articles and websites available that provide information on C++ programming concepts like algorithms, data structures, and algorithms. Use Google to search for ""C++ tutorials"" or something similar to find resources that fit your needs.

I hope these suggestions help you get started with learning C++!",1085,253,57.414,1.991,4.41,0.0,96.31,"[0.0, 0.0, 0.0, 0.0]",1800.0,1121.15,1128.57,7.42,14.4,80.8,throttled=0x80000,0.913,2.912,2.659,152.69,1.657
